{
  "case_id": "PRIM_POSITIVE_OVERLAP",
  "classification": "corrected_expectation",
  "deviations": [],
  "generator": {
    "commit": "75b31ff01e6ff438d0f24c8ea7d6e6f92ab6c553",
    "files": [
      "reference/tools/build_g2_cases.py",
      "reference/tools/geometry_golden.py"
    ],
    "sha256": "fbc6e32468370e2eb3994721031ba3378d4ea96c1e2d315a920f3ff43b35b200",
    "version": "0.2.0"
  },
  "input": {
    "domain": "boundary_policy",
    "geometry": null,
    "inputs": null,
    "kind": "primitive",
    "primitive": {
      "arguments": {
        "u": [
          [
            0.0,
            0.0
          ],
          [
            2.0,
            0.0
          ]
        ],
        "v": [
          [
            1.0,
            0.0
          ],
          [
            3.0,
            0.0
          ]
        ]
      },
      "operation": "classify_intersection"
    }
  },
  "nonfinite_mask": [],
  "provenance": {
    "case_sha256": "e8f1365b448d44347d3e5b60e3b79b4bd13bda55cae530eefc43ec9d13de2cab",
    "license_relevance": "derived fixture; upstream BSD-3-Clause notice retained in reference/PVLIB_LICENSE.txt",
    "method": "CDR-003/CDR-006 candidate policy applied to normalized reference",
    "payload_sha256": "8f93c81213b6d3b380590e87e6661d891531f2505a335b750d74362d5dc6e214",
    "source": "pvlib/solarfactors@ecbfc863657e239817603a43898ae173c7ccad9c",
    "transformation": "field-level corrections are listed in deviations"
  },
  "reference": {
    "commit": "ecbfc863657e239817603a43898ae173c7ccad9c",
    "environment_id": "031158a1d1be8cdb9093",
    "name": "pvlib/solarfactors",
    "numpy": "2.3.5",
    "pvlib": "0.14.0",
    "python": "3.12.14",
    "runtime": {
      "environment_id": "031158a1d1be8cdb9093",
      "geos": "3.13.1",
      "implementation": "CPython",
      "libc": {
        "name": "glibc",
        "version": "2.39"
      },
      "machine": "x86_64",
      "packages": {
        "jsonschema": "4.25.1",
        "numpy": "2.3.5",
        "pandas": "2.2.3",
        "pvlib": "0.14.0",
        "scipy": "1.17.0",
        "shapely": "2.1.2"
      },
      "platform": "Linux-6.12.76-linuxkit-x86_64-with-glibc2.39",
      "python": "3.12.14",
      "system": "Linux",
      "thread_environment": {
        "MKL_NUM_THREADS": "1",
        "OMP_NUM_THREADS": "1",
        "OPENBLAS_NUM_THREADS": "1",
        "PYTHONHASHSEED": "0"
      }
    },
    "shapely": "2.1.2",
    "version": "v1.6.1"
  },
  "result": {
    "classification": "positive_length_overlap",
    "outcome": "corrected_expectation",
    "positive_length_overlap": true
  },
  "schema_version": "0.1",
  "status": "candidate"
}
