{
  "case_id": "UNDERGROUND",
  "classification": "corrected_expectation",
  "deviations": [],
  "generator": {
    "commit": "01549e07c16bfe10a82d2889b1b62c58ef6861e7",
    "files": [
      "reference/tools/build_g2_cases.py",
      "reference/tools/geometry_golden.py"
    ],
    "sha256": "0e15dd7c850411c90f00f68bb2599dd85afeba9541daaddc01cad01fcffd91db",
    "version": "0.3.0"
  },
  "input": {
    "domain": "invalid",
    "geometry": {
      "axis_azimuth": 180.0,
      "cut": {},
      "gcr": 0.5,
      "ground_extent": [
        -100.0,
        100.0
      ],
      "n_pvrows": 3,
      "pvrow_height": 1.0,
      "pvrow_width": 3.0
    },
    "inputs": {
      "DHI": [
        100.0
      ],
      "DNI": [
        600.0
      ],
      "albedo": [
        0.25
      ],
      "solar_azimuth": [
        270.0
      ],
      "solar_zenith": [
        45.0
      ],
      "surface_azimuth": [
        270.0
      ],
      "surface_tilt": [
        80.0
      ],
      "timestamps": [
        "2019-06-01T12:00:00+00:00"
      ]
    },
    "kind": "ordered_pvarray",
    "primitive": null
  },
  "nonfinite_mask": [],
  "provenance": {
    "case_sha256": "5da6b0d55d207cd99a0b25b3fe1f99c0581b4f51150cbe6b91d016c8dd284496",
    "license_relevance": "derived fixture; upstream BSD-3-Clause notice retained in reference/PVLIB_LICENSE.txt",
    "method": "CDR-003/CDR-006 candidate policy applied to normalized reference",
    "payload_sha256": "bda9847964d5023ae0d37e89b7390255a9beb753e30b7c292f2661cb7a6661b7",
    "source": "pvlib/solarfactors@ecbfc863657e239817603a43898ae173c7ccad9c",
    "transformation": "field-level corrections are listed in deviations"
  },
  "reference": {
    "commit": "ecbfc863657e239817603a43898ae173c7ccad9c",
    "environment_id": "031158a1d1be8cdb9093",
    "name": "pvlib/solarfactors",
    "numpy": "2.3.5",
    "pvlib": "0.14.0",
    "python": "3.12.14",
    "runtime": {
      "environment_id": "031158a1d1be8cdb9093",
      "geos": "3.13.1",
      "implementation": "CPython",
      "libc": {
        "name": "glibc",
        "version": "2.39"
      },
      "machine": "x86_64",
      "packages": {
        "jsonschema": "4.25.1",
        "numpy": "2.3.5",
        "pandas": "2.2.3",
        "pvlib": "0.14.0",
        "scipy": "1.17.0",
        "shapely": "2.1.2"
      },
      "platform": "Linux-6.12.76-linuxkit-x86_64-with-glibc2.39",
      "python": "3.12.14",
      "system": "Linux",
      "thread_environment": {
        "MKL_NUM_THREADS": "1",
        "OMP_NUM_THREADS": "1",
        "OPENBLAS_NUM_THREADS": "1",
        "PYTHONHASHSEED": "0"
      }
    },
    "shapely": "2.1.2",
    "version": "v1.6.1"
  },
  "result": {
    "errors": [
      {
        "code": "GEOMETRY_CLEARANCE",
        "field": "inputs.surface_tilt[0]",
        "message": "row must remain more than 1e-10 m above ground"
      }
    ],
    "outcome": "v1_error",
    "panic": false
  },
  "schema_version": "0.1",
  "status": "v1_rejected_input"
}
