{
  "case_id": "PRIM_LINE_OFFSET_PLUS_ULP",
  "classification": "corrected_expectation",
  "deviations": [],
  "generator": {
    "commit": "01549e07c16bfe10a82d2889b1b62c58ef6861e7",
    "files": [
      "reference/tools/build_g2_cases.py",
      "reference/tools/geometry_golden.py"
    ],
    "sha256": "0e15dd7c850411c90f00f68bb2599dd85afeba9541daaddc01cad01fcffd91db",
    "version": "0.3.0"
  },
  "input": {
    "domain": "boundary_policy",
    "geometry": null,
    "inputs": null,
    "kind": "primitive",
    "primitive": {
      "arguments": {
        "coordinate_scale_m": 1.0,
        "line": [
          [
            0.0,
            0.0
          ],
          [
            1.0,
            0.0
          ]
        ],
        "point": [
          0.5,
          1.0000000000000002e-10
        ]
      },
      "operation": "classify_line_offset"
    }
  },
  "nonfinite_mask": [],
  "provenance": {
    "case_sha256": "bbfc221e47efaa3c90e1e0566e7fcfb6f239913f2918755c12ee2bc3565c8549",
    "license_relevance": "derived fixture; upstream BSD-3-Clause notice retained in reference/PVLIB_LICENSE.txt",
    "method": "CDR-003/CDR-006 candidate policy applied to normalized reference",
    "payload_sha256": "9dc671c5675b0f2abafdab75820333bb4eb42a9bd099894a0e181686676e15db",
    "source": "pvlib/solarfactors@ecbfc863657e239817603a43898ae173c7ccad9c",
    "transformation": "field-level corrections are listed in deviations"
  },
  "reference": {
    "commit": "ecbfc863657e239817603a43898ae173c7ccad9c",
    "environment_id": "031158a1d1be8cdb9093",
    "name": "pvlib/solarfactors",
    "numpy": "2.3.5",
    "pvlib": "0.14.0",
    "python": "3.12.14",
    "runtime": {
      "environment_id": "031158a1d1be8cdb9093",
      "geos": "3.13.1",
      "implementation": "CPython",
      "libc": {
        "name": "glibc",
        "version": "2.39"
      },
      "machine": "x86_64",
      "packages": {
        "jsonschema": "4.25.1",
        "numpy": "2.3.5",
        "pandas": "2.2.3",
        "pvlib": "0.14.0",
        "scipy": "1.17.0",
        "shapely": "2.1.2"
      },
      "platform": "Linux-6.12.76-linuxkit-x86_64-with-glibc2.39",
      "python": "3.12.14",
      "system": "Linux",
      "thread_environment": {
        "MKL_NUM_THREADS": "1",
        "OMP_NUM_THREADS": "1",
        "OPENBLAS_NUM_THREADS": "1",
        "PYTHONHASHSEED": "0"
      }
    },
    "shapely": "2.1.2",
    "version": "v1.6.1"
  },
  "result": {
    "offset_m": 1.0000000000000002e-10,
    "outcome": "corrected_expectation",
    "threshold_m": 1e-10,
    "within": false
  },
  "schema_version": "0.1",
  "status": "candidate"
}
