{
  "case_id": "PRIM_ORIENTATION_MINUS_ULP",
  "classification": "corrected_expectation",
  "deviations": [],
  "generator": {
    "commit": "01549e07c16bfe10a82d2889b1b62c58ef6861e7",
    "files": [
      "reference/tools/build_g2_cases.py",
      "reference/tools/geometry_golden.py"
    ],
    "sha256": "0e15dd7c850411c90f00f68bb2599dd85afeba9541daaddc01cad01fcffd91db",
    "version": "0.3.0"
  },
  "input": {
    "domain": "boundary_policy",
    "geometry": null,
    "inputs": null,
    "kind": "primitive",
    "primitive": {
      "arguments": {
        "coordinate_scale_m": 1.0,
        "u": [
          1.0,
          0.0
        ],
        "v": [
          1.0,
          9.999999999999998e-13
        ]
      },
      "operation": "classify_orientation"
    }
  },
  "nonfinite_mask": [],
  "provenance": {
    "case_sha256": "5fd855ed5bd881434e22400fbe1c92146d984ae018c0f503b67151aceba5e56e",
    "license_relevance": "derived fixture; upstream BSD-3-Clause notice retained in reference/PVLIB_LICENSE.txt",
    "method": "CDR-003/CDR-006 candidate policy applied to normalized reference",
    "payload_sha256": "2cc1086e83e38ea5f8b098f68a6489b31a377bd9b83e93200674e4fc13f24f3f",
    "source": "pvlib/solarfactors@ecbfc863657e239817603a43898ae173c7ccad9c",
    "transformation": "field-level corrections are listed in deviations"
  },
  "reference": {
    "commit": "ecbfc863657e239817603a43898ae173c7ccad9c",
    "environment_id": "031158a1d1be8cdb9093",
    "name": "pvlib/solarfactors",
    "numpy": "2.3.5",
    "pvlib": "0.14.0",
    "python": "3.12.14",
    "runtime": {
      "environment_id": "031158a1d1be8cdb9093",
      "geos": "3.13.1",
      "implementation": "CPython",
      "libc": {
        "name": "glibc",
        "version": "2.39"
      },
      "machine": "x86_64",
      "packages": {
        "jsonschema": "4.25.1",
        "numpy": "2.3.5",
        "pandas": "2.2.3",
        "pvlib": "0.14.0",
        "scipy": "1.17.0",
        "shapely": "2.1.2"
      },
      "platform": "Linux-6.12.76-linuxkit-x86_64-with-glibc2.39",
      "python": "3.12.14",
      "system": "Linux",
      "thread_environment": {
        "MKL_NUM_THREADS": "1",
        "OMP_NUM_THREADS": "1",
        "OPENBLAS_NUM_THREADS": "1",
        "PYTHONHASHSEED": "0"
      }
    },
    "shapely": "2.1.2",
    "version": "v1.6.1"
  },
  "result": {
    "normalized_abs_cross": 9.999999999999998e-13,
    "outcome": "corrected_expectation",
    "parallel": true,
    "threshold": 1e-12
  },
  "schema_version": "0.1",
  "status": "candidate"
}
