{
  "case_id": "PRIM_POINT_TOUCH",
  "classification": "normalized_reference",
  "deviations": [],
  "generator": {
    "commit": "5e864bf2d466191155dfe930b1c8e5de88cfccb1",
    "files": [
      "reference/tools/build_g2_cases.py",
      "reference/tools/geometry_golden.py"
    ],
    "sha256": "3f45224e1823bdeaf081efb33592deb34a99018a692c5407c1daf79135c15d83",
    "version": "0.1.0"
  },
  "input": {
    "domain": "boundary_policy",
    "geometry": null,
    "inputs": null,
    "kind": "primitive",
    "primitive": {
      "arguments": {
        "u": [
          [
            0.0,
            0.0
          ],
          [
            2.0,
            0.0
          ]
        ],
        "v": [
          [
            1.0,
            -1.0
          ],
          [
            1.0,
            1.0
          ]
        ]
      },
      "operation": "classify_intersection"
    }
  },
  "nonfinite_mask": [],
  "provenance": {
    "case_sha256": "bbaf55f5c75100e9ef1017a93a2ab26700d127fcb619586cddb841a3f4ed2479",
    "license_relevance": "derived fixture; upstream BSD-3-Clause notice retained in reference/PVLIB_LICENSE.txt",
    "method": "direct frozen primitive invocation",
    "payload_sha256": "a80c72269bcbb6d3387a3d765e503f0809ae6697fcd51c20bec60efbe3afa164",
    "source": "pvlib/solarfactors@ecbfc863657e239817603a43898ae173c7ccad9c",
    "transformation": "canonical JSON; explicit nonfinite mask; stable logical ordering"
  },
  "reference": {
    "commit": "ecbfc863657e239817603a43898ae173c7ccad9c",
    "environment_id": "548e623fbc3038f5f020",
    "name": "pvlib/solarfactors",
    "numpy": "2.3.5",
    "pvlib": "0.14.0",
    "python": "3.12.12",
    "runtime": {
      "environment_id": "548e623fbc3038f5f020",
      "implementation": "CPython",
      "machine": "arm64",
      "packages": {
        "jsonschema": "4.25.1",
        "numpy": "2.3.5",
        "pandas": "2.2.3",
        "pvlib": "0.14.0",
        "scipy": "1.17.0",
        "shapely": "2.1.2"
      },
      "platform": "macOS-26.6.2-arm64-arm-64bit",
      "python": "3.12.12",
      "thread_environment": {
        "MKL_NUM_THREADS": "1",
        "OMP_NUM_THREADS": "1",
        "OPENBLAS_NUM_THREADS": "1",
        "PYTHONHASHSEED": "0"
      }
    },
    "shapely": "2.1.2",
    "version": "v1.6.1"
  },
  "result": {
    "classification": "point_touch",
    "intersection_length_m": 0.0,
    "operation": "classify_intersection",
    "outcome": "captured"
  },
  "schema_version": "0.1",
  "status": "candidate"
}
