{
  "case_id": "PRIM_COMPLETE_COVER_DIFFERENCE",
  "classification": "raw_reference",
  "deviations": [
    {
      "cdr_id": "CDR-006",
      "corrected_expectation": 0.0,
      "dev_id": "DEV-016",
      "explanation": "the minuend is completely covered and the mathematical difference is empty",
      "field": "result.length_m",
      "raw_reference": 1.0
    }
  ],
  "generator": {
    "commit": "50500914c227aaeaf738b785eea3a20d96e8ee28",
    "files": [
      "reference/tools/build_g2_cases.py",
      "reference/tools/geometry_golden.py"
    ],
    "sha256": "32b3c882980a2ea24479efcd155fdaf5e56ed3a042f370939a22b8f9122c8e40",
    "version": "0.1.0"
  },
  "input": {
    "domain": "reference_deviation",
    "geometry": null,
    "inputs": null,
    "kind": "primitive",
    "primitive": {
      "arguments": {
        "u": [
          [
            0.0,
            0.0
          ],
          [
            1.0,
            0.0
          ]
        ],
        "v": [
          [
            -1.0,
            0.0
          ],
          [
            2.0,
            0.0
          ]
        ]
      },
      "operation": "difference"
    }
  },
  "nonfinite_mask": [],
  "provenance": {
    "case_sha256": "cbc1dbf892a86f19f3d4f9e1943e270931f1d736dad2159472638765cf1de5d0",
    "license_relevance": "derived fixture; upstream BSD-3-Clause notice retained in reference/PVLIB_LICENSE.txt",
    "method": "direct frozen primitive invocation",
    "payload_sha256": "d034138301974bd8a2dbdbc63f28aa12c2437834959ea315c7657ab7ac9e8b58",
    "source": "pvlib/solarfactors@ecbfc863657e239817603a43898ae173c7ccad9c",
    "transformation": "none"
  },
  "reference": {
    "commit": "ecbfc863657e239817603a43898ae173c7ccad9c",
    "environment_id": "031158a1d1be8cdb9093",
    "name": "pvlib/solarfactors",
    "numpy": "2.3.5",
    "pvlib": "0.14.0",
    "python": "3.12.14",
    "runtime": {
      "environment_id": "031158a1d1be8cdb9093",
      "geos": "3.13.1",
      "implementation": "CPython",
      "libc": {
        "name": "glibc",
        "version": "2.39"
      },
      "machine": "x86_64",
      "packages": {
        "jsonschema": "4.25.1",
        "numpy": "2.3.5",
        "pandas": "2.2.3",
        "pvlib": "0.14.0",
        "scipy": "1.17.0",
        "shapely": "2.1.2"
      },
      "platform": "Linux-6.12.76-linuxkit-x86_64-with-glibc2.39",
      "python": "3.12.14",
      "system": "Linux",
      "thread_environment": {
        "MKL_NUM_THREADS": "1",
        "OMP_NUM_THREADS": "1",
        "OPENBLAS_NUM_THREADS": "1",
        "PYTHONHASHSEED": "0"
      }
    },
    "shapely": "2.1.2",
    "version": "v1.6.1"
  },
  "result": {
    "coordinates": [
      [
        [
          0.0,
          0.0
        ],
        [
          1.0,
          0.0
        ]
      ]
    ],
    "geometry_type": "LineString",
    "length_m": 1.0,
    "operation": "difference",
    "outcome": "captured"
  },
  "schema_version": "0.1",
  "status": "candidate"
}
